<?xml version="1.0" encoding="UTF-8"?>
<prenotazioni xmlns:xsi="http://www.w3.org/2001/XMLSchema-instance" xsi:noNamespaceSchemaLocation="prenotazione.xsd">
  <prenotazione>
    <id>1</id>
    <matricolaStudente>1</matricolaStudente>
    <idAppello>3</idAppello>
    <esito>24</esito>
  </prenotazione>
  <prenotazione>
    <id>2</id>
    <matricolaStudente>1</matricolaStudente>
    <idAppello>5</idAppello>
    <esito>29</esito>
  </prenotazione>
<prenotazione><id>3</id><matricolaStudente>1</matricolaStudente><idAppello>7</idAppello><esito>B</esito></prenotazione></prenotazioni>
